sent1	sent2	theme	score
What is the difference between shawarma and gyros?	What is the difference between portamento and glissando?	question-question	0.0
What is the significance of the cat?	What is the significance of the artwork?	question-question	0.0
What kind of spider web is this - and how do I get rid of it?	What kind of board is this, and where can I get some?	question-question	0.0
What's the best way to store potatoes and maximize their shelf-life?	What is the best way to store fresh berries?	question-question	0.0
What is the difference between a stock and a bond?	What is the difference between a tortoise and a turtle?	question-question	0.0
What is the difference between mono and stereo?	What is the difference between balls in Test and ODI Cricket?	question-question	0.0
What is the best way to store my sleeping bag for long periods of time?	What's the best way to store asparagus?	question-question	0.0
To explain further vector space models, basically a document is characterized by a vector.	A document is represented as a vector.	plagiarism	5.0
The differing application has a direct influence on what the definition of the term means.	The way that a 'term' is defined depends on the application.	plagiarism	5.0
"Thus, the ""program"" is the optimal plan of action that is being produced."	"Thus, the ""program"" is the optimal plan for action that is produced."	plagiarism	5.0
"Thus, the ""program"" is the optimal plan for action that is produced."	"Therefore, the ""program"" is the optimal plan for action that is produced."	plagiarism	5.0
P(B) (a.k.a. the normalizing constant) is the prior or marginal probability of B.	P(B) is the prior or marginal probability of B, and acts as a normalizing constant.	plagiarism	5.0
In general, we can solve a problem with optimal substructure using a three-step process: 1.	In a word, we can solve a problem with optimal substructure using a three-step process.	plagiarism	5.0
One of its uses is calculating posterior probabilities given observations.	It is usually used to calculate posterior probabilities given observations.	plagiarism	5.0
The way that a 'term' is defined depends on the application.	The definition of term is dependent on the application.	plagiarism	5.0
Its first application was in the SMART Information Retrieval System.	It was used in the first time in the SMART Information Retrieval System.	plagiarism	5.0
Thus, the program is the best plan for action that is produced.	"Thus, the ""program"" is the optimal plan of action that is being produced."	plagiarism	5.0
It is usually used to calculate posterior probabilities given observations.	It is usually be used to compute posterior probabilities given observations.	plagiarism	5.0
The methodology takes much less time rather than naive methods.	The method takes much less time than naive methods.	plagiarism	5.0
The methodology takes much less time rather than naive methods.	This is a much quicker method than other more naive methods.	plagiarism	5.0
The definition of term is dependent on the application.	The definition of term depends on the application.	plagiarism	5.0
Whilst Bayesians describe probabilities in terms of beliefs and degrees of uncertainty.	At the same time, Bayesians describe probabilities in terms of beliefs and degrees of uncertainty.	plagiarism	5.0
It is used in information filtering, information retrieval, indexing and relevancy rankings.	It is used in information filtering, indexing, relevancy rankings and information retrieval.	plagiarism	5.0
Several different ways of computing these values, also known as (term) weights, have been developed.	Several different ways of computing these values, additionally known as (term) weights, have been developed.	plagiarism	5.0
If a term exists in a document, its value in the vector is not equal to zero.	If a term appears in the document then its value in the vector is non-zero.	plagiarism	5.0
A hyperlink to a page counts as a vote of support.	A link to a page is seen as a vote of support.	plagiarism	5.0
For instance, a finalized schedule of events at an exhibition is sometimes called a program.	For example, a schedule of events at an exhibition is sometimes called a programme.	plagiarism	5.0
Nevertheless, the patent is assigned to the University of Stanford and not to Google.	However, the patent is assigned to Stanford University and not to Google.	plagiarism	5.0
The definition of term depends on the application.	The definition of a term depends on the application.	plagiarism	5.0
Inheritance is a method of forming new classes using predefined classes.	Inheritance in object oriented programming is a way to form new classes using classes that have already been defined.	plagiarism	5.0
Thus, the program is the best plan for action that is produced.	"Thus, the ""program"" is the optimal plan for action that is produced."	plagiarism	5.0
"Therefore, the ""program"" is the optimal plan for action that is produced."	"The ""program"" is the optimal plan for action that is produced."	plagiarism	5.0
If a term appears in the document, the terms value in the vector is non-zero.	A term which occurs in the document has a value in the vector of non-zero.	plagiarism	5.0
The vector space model has some limitations: 1.	LIMITATION: There is some limitation of vector space model.	plagiarism	5.0
The vector space model has the following limitations: 1.	The vector space model has some limitations: 1.	plagiarism	5.0
Typically terms are single words, keywords, or longer phrases.	Typically terms are keywords, single words or longer phrases.	plagiarism	5.0
It does not take into account any information about B and therefore is considered “prior”.	"It doesn't take into account any information about B, so it is ""prior""."	plagiarism	5.0
A document is represented as a vector and each dimension corresponds to a separate term.	When a document is represented as a vector, each dimension corresponds to a separate term.	plagiarism	5.0
Since it is a formal theorem, Bayes' theorem holds in all popular interpretations of probability.	As a formal theorem, Bayes' theorem is valid in all common interpretations of probability.	plagiarism	5.0
The methodology takes much less time rather than naive methods.	The method is more effiecent than naive methods.	plagiarism	5.0
Typically terms are keywords, single words or longer phrases.	Single words, keywords and occasionally longer phrases are used for terms.	plagiarism	5.0
Construct an optimal solution from computed values.	Generate the optimal solution of these computed values	plagiarism	5.0
Several different ways of computing these values, additionally known as (term) weights, have been developed.	Several different ways have been developed of calculating these values (also known as term weights).	plagiarism	5.0
In general, dynamic programming is used on optimisation problems, where the most efficient solution is needed.	However, the key in Dynamic Programming is to determine the structure of optimal solutions.	plagiarism	5.0
One of the best known schemes is tf-idf weighting (see the example below).	One of the best known methods is called tf-idf weighting.	plagiarism	4.0
For instance, a events schedule at an exhibition is sometimes called a program.	For instance, a finalized schedule of events at an exhibition is sometimes called a program.	plagiarism	4.0
Define value of optimal solution recursively.	Characterise structure of an optimal solution.	plagiarism	4.0
It was first used in the SMART Information Retrieval System.	It is used in information retrieval and was first used in the SMART Information Retrieval System.	plagiarism	4.0
The value of a vector is non-zero if a term occurs in the document.	A term which occurs in the document has a value in the vector of non-zero.	plagiarism	4.0
Several different ways of computing these values, also known as (term) weights, have been developed.	Other ways of computing these values, or weights, have been developed.	plagiarism	4.0
Several different ways of computing these values, also known as (term) weights, have been developed.	Many different ways of calculating these values, also known as (term) weights, have been developed.	plagiarism	4.0
These subproblems are not, however, independent.	It is similar to divide and conquer, however is differentiated as its subproblems are not independent.	plagiarism	4.0
The key to Dynamic Programming is to find the structure of optimal solutions.	In general, dynamic programming is used on optimisation problems, where the most efficient solution is needed.	plagiarism	4.0
Bayes Theorem is a mathematical formula used to calculate conditional probabilities.	Bayes' theorem relates the conditional and marginal probabilities of two random events.	plagiarism	4.0
Construct an optimal solution from computed values.	Define value of optimal solution recursively.	plagiarism	4.0
The theorem is often used when we have observations and wish to compute posterior probabilities.	It is often used to calculate posterior probabilities given observations.	plagiarism	4.0
P(B) is the prior or marginal probability of B, and acts to normalise the probability.	P(B) (a.k.a. the normalizing constant) is the prior or marginal probability of B.	plagiarism	4.0
In probability theory, Bayes' theorem relates the conditional and marginal probabilities of two random events.	Bayes' theorem relates the conditional and marginal probabilities of two random events.	plagiarism	4.0
Programming, in this sense, means finding an acceptable plan of action.	Programming, in this sense, means finding an acceptable plan, an algorithm.	plagiarism	4.0
The vector space model has some limitations: 1.	The vector space model has several disadvantages.	plagiarism	4.0
Using the vector space model for Information Retrieval models all pages and queries as high-dimensional sparse vectors.	A possible use for a vector space model is for retrieval and filtering of information.	plagiarism	4.0
One of the most famous schemes is tf-idf weighting.	One of the best known schemes is tf-idf (term frequency-inverse document frequency) weighting.	plagiarism	4.0
Vector space representation results in the loss of the order which the terms are in the document.	The order in which terms appear in the document is lost in a vector space representation.	plagiarism	4.0
Other ways of computing these values, or weights, have been developed.	Many different methods of calculating these values, sometimes known as (term) weights, have been developed.	plagiarism	4.0
It is usually be used to compute posterior probabilities given observations.	It is used to compute posterior probabilities given observations.	plagiarism	4.0
In computer science; dynamic programming is a way of solving problems consist of overlapping subproblems and optimal substructure.	Dynamic Programming is a very powerful mathematical technique, often utilised in programming, for solving optimization problems.	plagiarism	4.0
The most popular is tf-idf weighting.	One of the most famous schemes is tf-idf weighting.	plagiarism	4.0
Construct an optimal solution from computed values.	The last point would be to construct an optimal solution from the computed values.	plagiarism	4.0
This is a much quicker method than other more naive methods.	The method takes much less time than naive methods.	plagiarism	4.0
Inheritance in object oriented programming is a way to form new classes using classes that have already been defined.	inheritance in object oriented programming is where a new class is formed using classes which have allready been defined.	plagiarism	4.0
However, the vector space model has limitations.	The limitations of the vector space model are thus.	plagiarism	4.0
Programming, in this sense, means finding an acceptable plan of action.	Programming means finding a plan of action.	plagiarism	4.0
Dynamic Programming solves problems by combining the solutions of subproblems.	The key to Dynamic Programming is to find the structure of optimal solutions.	plagiarism	4.0
Subclasses are said to extend or specialise their superclasses.	Subclasses are said to ‘extend’ superclasses.	plagiarism	4.0
It is often used to compute posterior probabilities given observations.	The theorem is often used when we have observations and wish to compute posterior probabilities.	plagiarism	4.0
Every dimension is precisely related to a separate term.	Each and every dimension corresponds to a separate term.	plagiarism	4.0
Construct an optimal solution from computed values.	Use these optimal solutions to construct an optimal solution for the original problem.	plagiarism	4.0
Every dimension is precisely related to a separate term.	A document is represented as a vector, with each dimension corresponding to a separate term.	plagiarism	4.0
The most popular is tf-idf weighting.	One of the best known schemes is tf-idf (term frequency-inverse document frequency) weighting.	plagiarism	4.0
The theorem is often used when we have observations and wish to compute posterior probabilities.	It is usually be used to compute posterior probabilities given observations.	plagiarism	4.0
Overlapping subproblems means that the same subproblems are used to solve many different larger problems.	A problem with overlapping subproblems means that the same subproblems may be used to solve many different larger problems.	plagiarism	4.0
The differing application has a direct influence on what the definition of the term means.	The definition of term is dependent on the application.	plagiarism	4.0
The method takes much less time than naive methods.	And thus the method takes much less time than more naive methods.	plagiarism	4.0
In probability theory, Bayes' theorem relates the conditional and marginal probabilities of two random events.	In probability theory, the prior and conditional probabilities of two random events are related by Bayes' theorem.	plagiarism	4.0
Bayes’ theorem was names after Rev Thomas Bayes and is a method used in probability theory.	As an official theorem, Bayes' theorem is valid in all universal interpretations of probability.	plagiarism	3.0
• P(A|B) is the conditional probability of A, given B.	• P(B|A) is the conditional probability of B given A.	plagiarism	3.0
"It is ""previous"" in the sense that it does not take into account any information about B."	It does not take into account any information about B and therefore is considered “prior”.	plagiarism	3.0
When a document is represented as a vector, each dimension corresponds to a separate term.	Each dimensions corresponds to a separate terms.	plagiarism	3.0
The theorem is often used when we have observations and wish to compute posterior probabilities.	It is usually used to calculate posterior probabilities given observations.	plagiarism	3.0
When a document is represented as a vector, each dimension corresponds to a separate term.	Each dimension corresponds to a separate term.	plagiarism	3.0
In computer science; dynamic programming is a way of solving problems consist of overlapping subproblems and optimal substructure.	However, the key in Dynamic Programming is to determine the structure of optimal solutions.	plagiarism	3.0
For instance, a finalized schedule of events at an exhibition is sometimes called a program.	The typical example could be of a finalized schedule of events at an exhibition.	plagiarism	3.0
• P(B|A) is the conditional probability of B given A.	P(A|B) is the conditional probability of A, given B.	plagiarism	3.0
Since the PageRank is the most important algorithms which is used in the Google engine.	The PageRank is a recursive algorithm used by Google to determine which webpages are more important than others.	plagiarism	3.0
In the vector space model a document is represented as a vector.	A document is represented as a vector, and each dimension corresponds to a separate term.	plagiarism	3.0
So the same rule applies with keywords and indeed longer phrases.	Single words, keywords and occasionally longer phrases are used for terms.	plagiarism	3.0
Inheritance is a basic concept in object oriented programming.	Inheritance in object oriented programming is a way to form new classes using classes that have already been defined.	plagiarism	3.0
A document is represented as a vector, with each dimension corresponding to a separate term.	A document has representation as a vector.	plagiarism	3.0
In probability theory, Bayes' theorem relates the conditional and marginal probabilities of two random events.	Bayes Theorem is a mathematical formula used to calculate conditional probabilities.	plagiarism	3.0
A website’s page rank, is how ‘important’ it is on the web.	A variation of the PageRank method bases the importance of a webpage on how many visits the page gets.	plagiarism	3.0
If the term doesn’t occur within the document, the value in the vector is zero.	If a term appears in the document, the terms value in the vector is non-zero.	plagiarism	3.0
They also inherit the attributes and methods of its superclass.	The new classes are called derived classes and they inherit the behaviours and attributes of the base classes.	plagiarism	3.0
Bayes’ theorem was names after Rev Thomas Bayes and is a method used in probability theory.	As a formal theorem Bayes theorem is valid in all common interpretations of probability.	plagiarism	3.0
It is also called the posterior probability because it is derived from or depends upon the specified value of B.	It is also called the subsequent probability because it is derived from or depends upon the specified value of B.	plagiarism	3.0
One of the best known schemes is tf-idf weighting, proposed by Salton, Wong and Yang.	tf-idf weighting is one of the most well known schemes.	plagiarism	3.0
The vector space model has the following limitations: 1.	LIMITATION: There is some limitation of vector space model.	plagiarism	3.0
It is intended to help reuse existing code with little or no modification.	The idea of inheritance is to reuse the existing code with little or no modification at all.	plagiarism	3.0
The vector is then constucted of the frequency of eacher word (dimension).	The basic idea is to represent each document as a vector of certain weighted word frequencies.	plagiarism	3.0
The PageRank depends on the PageRank rating and number of all pages that have links to it.	of a particular page is roughly based upon the quantity of inbound links as well as the PageRank?	plagiarism	3.0
Single words, keywords and occasionally longer phrases are used for terms.	The number of unique words in the vocabulary denotes the dimensionality, if words are used for the terms.	plagiarism	3.0
The idea of inheritance is to reuse the existing code with little or no modification at all.	The idea of inheritance in OOP refers to the formation of new classes with the already existing classes.	plagiarism	3.0
It is valid in all common interpretations of probability.	As an official theorem, Bayes' theorem is valid in all universal interpretations of probability.	plagiarism	3.0
The value of a vector is non-zero if a term occurs in the document.	If the term doesn’t occur within the document, the value in the vector is zero.	plagiarism	3.0
When a document is represented as a vector, each dimension corresponds to a separate term.	In the vector space model a document is represented as a vector.	plagiarism	3.0
Inheritance is an important feature in object orientated programming.	The peropos of inheritance in object oriented programming is to minimize the reuse of existing code without modification.	plagiarism	3.0
So in essence it is a popularity contest between WebPages.	It is essentially a popularity meter.	plagiarism	3.0
The basic idea is to represent each document as a vector of certain weighted word frequencies.	In the vector space model a document is represented as a vector.	plagiarism	3.0
Object oriented programming is a style of programming that supports encapsulation, inheritance, and polymorphism.	Inheritance is a basic concept in object oriented programming.	plagiarism	3.0
The vector space model has some limitations: 1.	The limitations of the vector space model are thus.	plagiarism	3.0
The theorem is often used when we have observations and wish to compute posterior probabilities.	Bayes theorem can be used to compute the probability that a proposed diagnosis is correct.	plagiarism	3.0
One of the best known schemes is tf-idf weighting (see the example below).	One of the best known schemes is tf-idf weighting, proposed by Salton, Wong and Yang.	plagiarism	3.0
It is therefore used to create relationships between one object and another.	"It also provides a way to generalize du to the ""is a"" relationship between classes."	plagiarism	3.0
When a document is represented as a vector, each dimension corresponds to a separate term.	A document has representation as a vector.	plagiarism	3.0
If a term appears in the document then its value in the vector is non-zero.	A document is represented as a vector and each dimension corresponds to a separate term.	plagiarism	2.0
If a term exists in a document, its value in the vector is not equal to zero.	A document is represented as a vector, with each dimension corresponding to a separate term.	plagiarism	2.0
A document is represented as a vector, with each dimension corresponding to a separate term.	The basic idea is to represent each document as a vector of certain weighted word frequencies.	plagiarism	2.0
A document is represented as a vector.	The vector space model are the documents which are represented as “bags of words”.	plagiarism	2.0
A document is represented as a vector, with each dimension corresponding to a separate term.	The value of a vector is non-zero if a term occurs in the document.	plagiarism	2.0
To derive the theorem, we begin with the definition of conditional probability.	In probability theory, the prior and conditional probabilities of two random events are related by Bayes' theorem.	plagiarism	2.0
Characterise structure of an optimal solution.	Use these optimal solutions to construct an optimal solution for the original problem.	plagiarism	2.0
When a document is represented as a vector, each dimension corresponds to a separate term.	The basic idea is to represent each document as a vector of certain weighted word frequencies.	plagiarism	2.0
Break up the problem different smaller subproblems.	A problem with overlapping subproblems means that the same subproblems may be used to solve many different larger problems.	plagiarism	2.0
P(A) is the probability of the student being a girl (which is 2/5).	What is the probability this student is a girl?	plagiarism	2.0
This is highly used in dynamic programming.	There are four steps in Dynamic Programming: 1.	plagiarism	2.0
A term which occurs in the document has a value in the vector of non-zero.	A document is represented as a vector, with each dimension corresponding to a separate term.	plagiarism	2.0
When a document is represented as a vector, each dimension corresponds to a separate term.	To explain further vector space models, basically a document is characterized by a vector.	plagiarism	2.0
Terms are basically the words or any indexing unit used to identify the contents of a text.	In this classic model the term specific weights in the document vectors are products of local and global parameters.	plagiarism	2.0
The vector space model are the documents which are represented as “bags of words”.	In vector space model, the documents from which the information is to be retrieved are represented as vectors.	plagiarism	2.0
When any sub-problem is met again, it can be found and re-used to solve another problem.	It was intended to allow existing code to be used again with minimal or no alteration.	plagiarism	2.0
The vector space model are the documents which are represented as “bags of words”.	The limitations of the vector space model are thus.	plagiarism	2.0
This is highly used in dynamic programming.	The key to Dynamic Programming is to find the structure of optimal solutions.	plagiarism	2.0
The differing application has a direct influence on what the definition of the term means.	Terms are basically the words or any indexing unit used to identify the contents of a text.	plagiarism	2.0
As a formal theorem, Bayes' theorem is valid in all common interpretations of probability.	Bayes theorem can be used to compute the probability that a proposed diagnosis is correct.	plagiarism	2.0
It is mainly used to calculate the probability of one event’s outcome given that a previous event happened.	It is also called the posterior probability because it is derived from or depends upon the specified value of B.	plagiarism	2.0
The algebraic model for representing text documents and objects as vectors of identifiers is called the vector space model.	The limitations of the vector space model are thus.	plagiarism	2.0
It is used in information filtering, information retrieval, indexing and relevancy rankings.	A possible use for a vector space model is for retrieval and filtering of information.	plagiarism	2.0
Vector space representation results in the loss of the order which the terms are in the document.	If a term occurs in the document, the value will be non-zero in the vector.	plagiarism	1.0
Inheritance in object oriented programming is a way to form new classes using classes that have already been defined.	The peropos of inheritance in object oriented programming is to minimize the reuse of existing code without modification.	plagiarism	1.0
The algebraic model for representing text documents and objects as vectors of identifiers is called the vector space model.	A possible use for a vector space model is for retrieval and filtering of information.	plagiarism	1.0
Secondly to define the value of the optimal solution recursively.	Generalise the structure of an optimal solution 2.	plagiarism	1.0
There are two main approaches for dynamic programming.	There are four steps in Dynamic Programming: 1.	plagiarism	1.0
