sent1	sent2	theme	score
Quake of 6.2 magnitude strikes off Indonesia's Sumatra - USGS	Earthquake of 6.9 magnitude strikes off Indonesia island	headlines	3.0
Chinese satellite spots large object in search area	Malaysia: Chinese satellite found object in ocean	headlines	3.0
Goa building collapse death toll touches 15	Indian building collapse deaths rise to 14	headlines	3.0
Pak religious body endorses underage marriage	CII endorses underage marriage	headlines	3.0
EU Ministers of Employment and Social policy will discuss how to boost employment, integrate social and economic policies	EU Ministers of Employment and Social policy to discuss employment boosting strategies	headlines	3.0
U.S. and Russia reach a deal on Syria's chemical weapons	China welcomes US, Russia deal on Syria chemical weapons	headlines	3.0
Oklahoma examines what went wrong in botched execution	Okla. inmate dies of heart attack after botched execution	headlines	3.0
Thai protests escalate amid violence	Thai protesters call general strike	headlines	3.0
Egypt imposes state of emergency after 95 people killed	Egypt announces one-month state of emergency nationwide	headlines	3.0
UN warns of plight of women, children in Syria's Homs	UNICEF calls for immediate safe access to women, children in Homs	headlines	3.0
Sony to sell PC unit and cut jobs	Sony to axe PC unit in major business overhaul	headlines	3.0
Protests after George Zimmerman acquitted in Trayvon Martin case	Zimmerman acquitted in slaying	headlines	3.0
Jordan elected to take Saudi seat on UN Security Council	Jordan elected to UN security council seat that Saudi Arabia rejected	headlines	3.0
Maldives begins to vote in controversy-ridden presidential poll	Crisis-hit Maldives holds new presidential poll	headlines	3.0
Police surround protesters in Belfast ahead of G8	Peaceful anti-G8 protest held in Belfast	headlines	3.0
Ten rescued off Waterford, Dublin coasts	Six rescued after boat capsizes in Dublin Bay	headlines	3.0
World Cup hit by new stadium death	Worker dies at World Cup stadium	headlines	3.0
Greece reaches agreement with troika, bailout tranche expected within days	Debt inspectors reach agreement with Greece	headlines	3.0
Senior CPC official meets top DPRK leader's special envoy	North Korean leader sends 'special envoy' to China	headlines	3.0
US House Republicans elect Paul Ryan as speaker	US House Republicans eye reluctant Ryan for speaker	headlines	3.0
Top Asian News at 4:00 p.m. GMT	Top Asian News 8:39 a.m. GMT	headlines	3.0
Headlines in major Iranian newspapers on Sept 27	Headlines in several Iranian newspapers on Oct 19	headlines	3.0
Saudi-led airstrikes hit Yemeni capital	Saudi airstrikes in Yemen's capital kill 29	headlines	3.0
Militant attack from Afghanistan kills four in Upper Dir	Militant attack from Afghanistan kills FC soldier in Balochistan	headlines	3.0
Mali hunts jihadist nightclub killers	Militants attack UN as Mali hunts jihadist nightclub killers	headlines	3.0
Sierra Leone in Ebola lockdown	Sierra Leone Reaches Final Day of Ebola Lockdown	headlines	3.0
Israeli forces detain Palestinian MP in Hebron	Israeli forces detain 2 Palestinians in overnight arrest raids	headlines	3.0
More than 3,400 migrants rescued at sea in Mediterranean	Over 2,000 migrants rescued from wooden boats in Mediterranean	headlines	3.0
Israeli police clash with Palestinian protesters at sensitive Jerusalem holy site	Israel Police Clash With Palestinians in Jerusalem	headlines	3.0
Islamic State issues video of beheading of US hostage	Islamic State posts second propaganda video of UK hostage	headlines	3.0
Greece bailout uncertainty weighs on global markets	Greece concerns drag on Asia markets	headlines	3.0
Nepal earthquake death toll surpasses 7,000	Death toll in Nepal earthquake tops 8,000	headlines	3.0
US drone strike kills eight in Waziristan	US drone strike kills 11 in Pakistan	headlines	2.0
Boy, 14, arrested for sex attacks around a university campus	Two teenagers arrested after string of sex attacks on Manchester University campus	headlines	2.0
Obama orders Syria 'gas attack' inquiry	UN urges Syria gas attack inspection	headlines	2.0
Ukraine's jailed opposition icon Tymoshenko walks free	Ukraine's opposition chief wants more protests	headlines	2.0
Redford touts Alberta economy ahead of vote on leadership	Redford addresses PC convention ahead of leadership review	headlines	2.0
Man kills 4 in Calif. before police shoot him dead	Police: Gunman killed 6 in California shootings	headlines	2.0
N. Korea Deports Elderly American	North Korea deports detained US war veteran	headlines	2.0
Obama mulls limited military action in Syria	Obama urges military action against Syria, but will seek Congress' OK	headlines	2.0
One killed in clashes at Muslim Brotherhood Cairo offices	Egypt: Protesters storm Muslim Brotherhood's HQ	headlines	2.0
Saudi Women To Protest Against Driving Ban	Saudi women drive in protest with little problem	headlines	2.0
Nelson Mandela hospital release reports 'incorrect'	Nelson Mandela Goes Home After Hospital Stay	headlines	2.0
US to Determine Extent of Chemical Weapons Use by Syria	What we know so far about chemical weapons in Syria's civil war	headlines	2.0
Syria agrees to surrender chemical weapons	UK's Cameron: Syria, Russia must show chemical arms proposal is genuine	headlines	2.0
Russia's Putin claims authority to invade Ukraine	Kremlin: Putin yet to decide on using Russian troops in Ukraine	headlines	2.0
Singapore shares open 0.28% lower on Thursday	Singapore shares open 0.19% higher on Thursday	headlines	2.0
Headlines in major Iranian newspapers on Oct 4	Headlines in several Iranian newspapers on Oct 19	headlines	2.0
Bombings kill 9 people in Iraqi capital	Bombings kill 19 people in Iraq	headlines	2.0
10 Things to Know for Wednesday	10 Things to Know for Thursday	headlines	2.0
How the Dow Jones Industrial Average Did Wednesday	How the Dow Jones Industrial Average Fared on Monday	headlines	2.0
New UN peacekeeping chief named for Central African Republic	UN takes over peacekeeping in Central African Republic	headlines	2.0
Iraq bombings kill at least 26	Iraq suicide bomber kills at least 12	headlines	2.0
UN Security Council hears Yemen envoy's final ...	UN Security Council urges Yemen's Houthis to end...	headlines	2.0
13 killed in Afgan terror attack	6 killed in Afghan capital mosque attack	headlines	2.0
Rev's Early Reads: March 2	Rev.'s Early Reads: Sept. 3rd, 2015	headlines	2.0
Markets Live: Waiting for China data	Markets Live: China drags	headlines	2.0
Palestinians, Israeli police clash at Jerusalem's al-Aqsa	Palestinian Shot by Israeli Police in East Jerusalem Dies	headlines	2.0
The end of the Hong Kong protests?	UK 'concern' over Hong Kong protests	headlines	2.0
Russian warplanes strike inside Syria	Russian roulette in Syria	headlines	2.0
Nigeria Votes in Tight Presidential Election	Guineans Go to the Polls in Presidential Elections	headlines	2.0
Prince William dons samurai gear on Japan tour	Prince William of Britain arrives in Beijing	headlines	2.0
Micronesia vice president to visit China	Vice President of Bolivia to visit China	headlines	2.0
Iran ends cooperation agreement with Pakistan	Iran, Tajikistan sign cooperation agreement	headlines	2.0
New US Sanctions Target Overseas Cyber Attackers	China disagrees with U.S. sanctions program on overseas cyber attackers	headlines	2.0
Deadly Blast Rocks Coal Mine in East Ukraine	12 Dead, Despite Cease-fire in East Ukraine	headlines	2.0
Backstage Moves Intensify as Fight Against Islamic State Widens	Mixed Progress Reported in Fight Against Islamic State	headlines	2.0
Taiwan coast guard launches new ships as South China Sea tensions rise	Chinese military reaches out amid South China Sea tensions	headlines	2.0
Pro-Palestinian Activists March to UN Headquarters	Pro-Palestinian activists prepare flotilla to break Gaza blockade	headlines	2.0
All 224 dead in Russian airliner mystery crash	Heat flash detected at time of Russian airliner crash	headlines	2.0
Scientists prove there is water on Mars	Has Nasa discovered water on Mars?	headlines	2.0
Editors from around the world urge Turkey to protect media	Media freedom at stake as Turkey fights rebels	headlines	2.0
North Korea to put US citizen on trial	N Korea hit with new US sanctions	headlines	2.0
Hong Kong officials resume work as protests thin	Hong Kong student leaders mull protest retreat	headlines	2.0
Volkswagen skids into red in wake of pollution scandal	"Volkswagen's ""gesture of goodwill"" to diesel owners"	headlines	2.0
France shuts mosque, arrests man in crackdown after attacks	Security tightened at New Delhi churches after attacks	headlines	2.0
Russian plane reportedly crashes in Egypt	Pilot killed as US jet crashes in England	headlines	2.0
Mandela's condition has 'improved'	Mandela's condition has 'worsened over past 48 hours'	headlines	1.0
Search leader urges caution in findings related to missing Malaysian jetliner	Searchers hoping pings come from lost Malaysian airliner	headlines	1.0
Mandela remembered by family, as stadium memorial service is planned	Mandela's family thanks nation and world for support	headlines	1.0
Obama holds out over Syria strikes	UK urges countries over Syria aid	headlines	1.0
George Zimmerman found not guilty of Trayvon Martin murder	George Zimmerman Verdict Propels Cable News Into Talkradio Mode	headlines	1.0
Obama, Hollande Hail Transformed US-French Relationship	Hollande arrives for US state visit	headlines	1.0
Russian parliament allows Putin to use military in Ukraine	President Obama warns Russia to stay out of Ukraine	headlines	1.0
World stocks rise on hopes Fed to keep stimulus	Fed expected to maintain stimulus	headlines	1.0
No winners in a war of sanctions	The impact of sanctions on Russia	headlines	1.0
Tata Nano and other Indian small cars fail crash tests	How does world's cheapest car do in crash test?	headlines	1.0
Turkey unrest goes on despite end to park protest	"Turkish PM Erdogan says ""duty"" to order crackdown on Istanbul park protest"	headlines	1.0
Top Asian News at 2:30 p.m. GMT	Top Asian News 1:25 p.m. GMT	headlines	1.0
Singapore shares open 0.83% higher on Wednesday	Singapore shares open 0.06% lower on Tuesday	headlines	1.0
China treasury bond futures open higher Tuesday	China treasury bond futures close mixed Wednesday	headlines	1.0
7.3 magnitude earthquake strikes Nepal	6.6-magnitude earthquake strikes off Indonesia	headlines	1.0
Iran's parliament backs nuclear deal	Iran hardliners attack nuclear deal	headlines	1.0
Israeli forces arrest 21 Palestinians overnight, clash with locals	Israeli security forces arrest 8 Palestinians in overnight West Bank sweeps	headlines	1.0
CCTV of gunmen in Tunisia museum attack	19 killed in Tunis museum attack	headlines	1.0
Teenager tests negative for Ebola	Texas hospital worker tests positive for Ebola	headlines	1.0
Texas sues over Syrian refugees	Turkey 'exploits' Syrian refugees	headlines	1.0
Rooney helps Man United beat Everton 3-0 in Premier League	West Ham beats Newcastle 2-0 in Premier League	headlines	1.0
Hard-line Jewish leader shot in Jerusalem	Israeli leader urges calm in Jerusalem	headlines	1.0
Waba emerges new NLC president	Waiting for the next president	headlines	1.0
Egypt: IPI Urges Release of Al Jazeera Journalist Arrested in Berlin	Egypt sentences Al Jazeera journalists to jail	headlines	1.0
occupied Palestinian territory: Israeli Forces Continue to Shed Palestinian Blood in oPt	occupied Palestinian territory: Israel warns on security as Gaza truce talks resume	headlines	1.0
5 US airstrikes target Islamic State fighters	Kurds see Turkey impeding Islamic State fight	headlines	1.0
Burundi police fire tear gas at protesters	Montenegrin police fire teargas to disperse opposition	headlines	1.0
Ashya's Parents Arrive For Extradition Hearing	Ashya King's parents freed from jail in Spain	headlines	1.0
Nigeria admits slow response in Ebola case	US ramps up response to Ebola crisis	headlines	1.0
Thousands cross Austria-Hungary border	Thousands of Russians stranded abroad	headlines	1.0
Benzema faces possible charges in sex-tape case	Menendez faces possible corruption charges	headlines	1.0
US Senate votes to advance Iran nuclear review bill	US scientists praise Iran nuclear deal	headlines	1.0
Gunners fire but fail to advance in Champions League	EPL clubs out to avoid Champions League woes	headlines	1.0
Iranian President praises nuclear deal	Iran arrests several spies near nuclear plant	headlines	1.0
Boko Haram disrupts Nigerian elections	Press awash with Nigeria's general elections	headlines	1.0
South Korea regrets North's refusal of talks	South Korea reports 14th Mers death, 12 new cases	headlines	1.0
South Korea reports seven new MERS cases	South Korean woman in contact with MERS patient dies	headlines	1.0
U.S. military says it conducts airstrikes against IS in Syria, Iraq	Observatory says Russian air strikes kill 45 in Syria	headlines	1.0
UK Leader Signals Support for Airstrikes on IS in Syria	Why Cyprus backs Cameron's push for UK air strikes in Syria	headlines	1.0
Israel bars Palestinians from Jerusalem's Old City	Two-state solution between Palestinians, Israel pie in sky	headlines	1.0
How much do you know about Secret Service?	Lawmakers from both sides express outrage at Secret Service	headlines	1.0
UN chief welcomes peaceful presidential elections in Guinea	UN chief condemns attack against peacekeepers in Mali	headlines	1.0
At least 18 killed in Iraq mosque bombing	More than 60 killed at Iraq funeral	headlines	0.0
Malaysia Airlines plane crashes on Ukraine-Russia border - live	US: Russia Massing Troops on Ukraine Border	headlines	0.0
Tycoon claims win in Ukraine and promises to seek future in EU	Polling stations open at Ukrainian presidential election	headlines	0.0
The covert war in Pakistan	New major earthquake rocks southwest Pakistan	headlines	0.0
4 killed, several injured in SW China car accident	Two killed, seventeen injured in Raiwind road accident	headlines	0.0
4 dead, 3 injured in east China road accident	2 dead, 8 injured in central Israel traffic accident	headlines	0.0
Live Blog: Ukraine In Crisis	Live Blog: Iraq In Turmoil	headlines	0.0
Pope canonizes 2 Palestinians	Sweden recognizes Palestinian state	headlines	0.0
3 killed, 4 injured in Los Angeles shootings	Five killed in Saudi Arabia shooting	headlines	0.0
5 killed in Israeli air strikes in Gaza	38 IS militants killed in clashes, air strikes in Iraq	headlines	0.0
Funeral of Ian Paisley to take place in Belfast	Funeral of MH17 victim Liam Sweeney takes place in Newcastle	headlines	0.0
Libya: UN orders investigation into Libya rights abuses	India's top court orders investigation into job scam, deaths	headlines	0.0
Kranjcar leaves it late to rescue QPR against Moses-inspired Stoke	Harry Kane leaves it late to rescue a point for Tottenham Hotspur	headlines	0.0
Oscar Pistorius sentenced to 5 years in prison	'Bookkeeper of Auschwitz' Sentenced to Four Years in Prison	headlines	0.0
Govt. to hold talks with FTII students	Cameron to hold talks with Sturgeon on UK future	headlines	0.0
Li Na to announce retirement	US Senator Ted Cruz to announce presidential bid	headlines	0.0
Plane Crash Site Search Called off for the Night	Tour De France Pack Sets off for Stage 15	headlines	0.0
Obama queries Turnbull over China port deal	Spanish bulls gore seven to death	headlines	0.0
China's generous 1MDB bid seen reaping it big returns in Malaysia	China keeps an eye on visiting tiger freed by Russian President	headlines	0.0
Hezbollah targets Qaeda gathering along border with Syria	Belarus tightens security along the border with Ukraine	headlines	0.0
Obama calls for international front against IS	Obama vows to save Iraqis stranded on mountain	headlines	0.0
Who abandoned 3 Boeing planes at the airport?	Police abandon posts in Lesotho, fear for lives	headlines	0.0
Ebola UK: NHS staff 'panicked' after suspected Ebola cases	UK says investigating 2 suspected MERS cases	headlines	0.0
Philippines, Canada pledge to further boost relations	Philippines saves 100 after ferry sinks	headlines	0.0
N. Korea agrees to talks with South	Johor crowns its fifth Sultan	headlines	0.0
Iran, a large important partner for Russia: Novak	Iran reiterates support for Iraq, Syria	headlines	0.0
Taiwan's president charters plane to pay respects to Lee	Poland president loses to challenger	headlines	0.0
Two Palestinians die in attacks on Israelis ahead of Kerry visit	Palestinian official slams Israel's stone-throwing bill	headlines	0.0
Thomas Cook accused of putting costs before customers	University of Florida frat accused of spitting on wounded war veterans	headlines	0.0
Narendra Modi 'photoshopped' image of Chennai floods visit goes viral	PM Narendra Modi speaks of non-discrimination and equality	headlines	0.0
Obama Struggles to Soothe Saudi Fears As Iran Talks Resume	Myanmar Struggles to Finalize Voter Lists for Sunday Polls	headlines	0.0
Pakistan executions draw international ire	Pakistan protests ceasefire violations by India	headlines	0.0
South Korea declares end to MERS outbreak	North Korea Delegation Meets With South Korean Officials	headlines	0.0
Pranab stresses need to strive for peace by nations	WTO: India regrets action of developed nations	headlines	0.0
Two Australians killed in Kenya after bus crashed into river	Permalink to Two killed in Germany train accident	headlines	0.0
Severe Gales As Storm Clodagh Hits Britain	Merkel pledges NATO solidarity with Latvia	headlines	0.0
Dozens of Egyptians hostages taken by Libyan terrorists as revenge for airstrikes	Egyptian boat crash death toll rises as more bodies found in Nile	headlines	0.0
President heading to Bahrain	President Xi: China to continue help to fight Ebola	headlines	0.0
China, India vow to further bilateral ties	China Scrambles to Reassure Jittery Stock Traders	headlines	0.0
Obama is right: Africa deserves better leadership	Obama waiting for midterm to name attorney general	headlines	0.0
Putin spokesman: Doping charges appear unfounded	The Latest on Severe Weather: 1 Dead in Texas After Tornado	headlines	0.0
New video shows US police officers beating mentally-ill man	New York police officer critically wounded in hatchet attack	headlines	0.0
You do not need to worry.	You don't have to worry.	answer-answer	5.0
You can do it, too.	Yes, you can do it.	answer-answer	5.0
The answer to both questions is: Yes.	The answer to both of your questions is yes.	answer-answer	5.0
You guys are making this all WAAAAAY too complicated.	You are making this too complicated.	answer-answer	5.0
It's not a good idea.	It is not a good idea.	answer-answer	5.0
Take a look at these:	Take a look at this: 	answer-answer	5.0
This is not a good idea.	But it is not a good idea.	answer-answer	5.0
I was in a similar situation.	I had a similar situation.	answer-answer	5.0
I've had this same problem.	I had this same problem.	answer-answer	5.0
You answered your own question.	You have answered your own question.	answer-answer	5.0
I don't see why there should be any problem with this whatsoever.	I don't see why that should be a problem.	answer-answer	5.0
It makes absolutely NO difference.	No, it makes no difference.	answer-answer	5.0
I think it's fine to ask this question.	I think it is okay to ask the question.	answer-answer	5.0
There's not a lot you can do about that.	I'm afraid there's not really a lot you can do.	answer-answer	5.0
You answered your own question.	You've answered your own question already.	answer-answer	5.0
Can you do this?	Can you do it?	answer-answer	5.0
How do you do that?	How to do that?	answer-answer	5.0
It's also a matter of taste.	It's definitely just a matter of preference.	answer-answer	5.0
I don't see why there should be any problem with this whatsoever.	I don't see why this could be a problem.	answer-answer	5.0
There's not a lot you can do about that.	I really do not think there is much you can do about that.	answer-answer	5.0
You got it right.	Yes you got it.	answer-answer	5.0
There are two things to consider:	A couple things to consider:	answer-answer	5.0
Can you do this?	So, CAN you do this?	answer-answer	5.0
There are a few things you can do: 	There are a couple things you can try.	answer-answer	5.0
You got it right.	You've got it right.	answer-answer	5.0
You answered your own question.	You pretty much answered your own question.	answer-answer	5.0
You are on the right path.	You're on the right path.	answer-answer	5.0
What are your goals?	What are you goals?	answer-answer	5.0
A few more point to think about:	A few things to think about:	answer-answer	5.0
I'm afraid we are out of luck in this one.	I think this is one of those things where you are just out of luck.	answer-answer	5.0
It's also a matter of taste.	It's mostly a matter of taste.	answer-answer	5.0
I had the same problem as you.	I have just had the same problem.	answer-answer	5.0
I'm thinking it's a bad idea. 	I think it's a bad idea.	answer-answer	5.0
It's not a good idea.	Not a good idea.	answer-answer	5.0
I had the same problem as you.	I have exactly the same problem.	answer-answer	5.0
There are two things to consider:	I think there are two important things to consider:	answer-answer	5.0
It's pretty much up to you.	It is up to you.	answer-answer	5.0
There are three options:	There are only three options:	answer-answer	5.0
So think it in this way.	Think of it this way.	answer-answer	5.0
Maybe this could work for you.	Maybe this can work for you.	answer-answer	5.0
This is not a good idea.	Not a good idea.	answer-answer	5.0
I realized there is already an accepted answer but I figure I would add my 2 cents.	I know this is an old question but I feel I should add my 2 cents.	answer-answer	5.0
You may have to experiment and find what you like.	You have to find out what works for you.	answer-answer	5.0
I agree with the other comments.	I agree with the previous comments.	answer-answer	5.0
It rather depends on which country you're in.	That depends on which country you are in.	answer-answer	5.0
This is a terrible idea.	This is a bad idea.	answer-answer	5.0
You have to decide what you want to get out of this.	You have to know what you want to do.	answer-answer	4.0
I have few suggestions for you:	I have two suggestions for you:	answer-answer	4.0
As soon as possible.	Start them as early as possible.	answer-answer	4.0
To give this an answer:	I'll answer this question:	answer-answer	4.0
Unfortunately the answer to your question is we simply do not know.	Sorry, I don't know the answer to your question.	answer-answer	4.0
The rule - When in doubt throw it out!	"I always go by the rule ""When in doubt, throw it out!"	answer-answer	4.0
This is not a good idea.	This sound like a very bad idea.	answer-answer	4.0
It probably depends on the cut of meat.	It depends on the meat and how it's cut.	answer-answer	4.0
Have you tried asking your employees?	Have you tried asking?	answer-answer	4.0
There are two things to consider:	There are two possible causes for this:	answer-answer	4.0
It depends on what you want to do next, and where you want to do it.	In other words, it depends on where you go, when you do there and how.	answer-answer	4.0
I have the same thing.	I have had the same problem.	answer-answer	4.0
"My answer to your question is ""Probably Not""."	I think that the short  answer to your question is: No.	answer-answer	4.0
I don't think it makes any tremendous difference.	I don't think it makes much difference.	answer-answer	4.0
It's not a good idea.	I do not think it's a good idea.	answer-answer	4.0
You are on the right path.	You are right on the mark.	answer-answer	4.0
How should I proceed about this?	So how should I do this?	answer-answer	4.0
Does this page answer your question?	Does this answer your questions?	answer-answer	4.0
I'm going to be very direct here.	I'm going to be blunt, here: You don't.	answer-answer	4.0
It depends entirely on your company and your contract.	I guess it depends on the nature of your contract.	answer-answer	4.0
There are a few things I think you should do.	There are quite a few things you would need to do;	answer-answer	4.0
How do you do that?	How should you do that?	answer-answer	4.0
I was in a similar situation.	I am in a similar situation.	answer-answer	4.0
It depends on what you want to do next, and where you want to do it.	It's up to you what you want to do next.	answer-answer	4.0
Well, I wouldn't put it on my cv.	I wouldn't put this job on my resume.	answer-answer	4.0
I think there isn't a general answer.	I don't think there is an answer for this.	answer-answer	4.0
Work into it slowly.	You work on it slowly.	answer-answer	4.0
It varies by the situation.	This varies by institution.	answer-answer	4.0
I have the same thing.	I have the same problem.	answer-answer	4.0
I have the same thing.	I have the exact same problem.	answer-answer	4.0
You have to decide what you want to get out of this.	You have to find out what works for you.	answer-answer	4.0
It's not a good idea.	No, it's not a good thing.	answer-answer	4.0
You have a problem.	This is a big problem.	answer-answer	4.0
Unfortunately, this question cannot be answered in its full generality.	This cannot be answered in general.	answer-answer	4.0
I think there isn't a general answer.	I don't think there is a single definition.	answer-answer	4.0
"My answer to your question is ""Probably Not""."	The answer to your question is not really.	answer-answer	4.0
I had the same problem as you.	I had the same issue.	answer-answer	4.0
Hope this is what you are looking for.	Is this the kind of thing you're looking for ?	answer-answer	4.0
There are a few things you can do: 	There are a few things you need to consider:	answer-answer	4.0
It depends on what you want to do next, and where you want to do it.	It depends on what and where you are going to do.	answer-answer	4.0
In the US, it will depend on the school.	This will depend on the university.	answer-answer	4.0
There are a few things I think you should do.	There are a few minimally-effective things you can do at the personal level.	answer-answer	4.0
